Product_Name,Pricing,Rating
Vivo U10 (Electric Blue| 32 GB),Rs.9990,4.412,464
Vivo U10 (Thunder Black| 32 GB),Rs.9990,4.412,464
Vivo Z1Pro (Sonic Black| 128 GB),Rs.16990,4.51,25,860
Vivo Z1Pro (Sonic Black| 64 GB),Rs.13990,4.53,12,821
Vivo Z1Pro (Sonic Blue| 128 GB),Rs.16990,4.51,25,860
Vivo Z1Pro (Sonic Black| 64 GB),Rs.14990,4.51,25,860
Vivo Z1Pro (Sonic Blue| 64 GB),Rs.13990,4.53,12,821
Vivo Z1Pro (Sonic Blue| 64 GB),Rs.14990,4.51,25,860
Vivo U10 (Electric Blue| 64 GB),Rs.10490,4.412,464
Vivo Z1x (Fusion Blue| 128 GB),Rs.17990,4.41,17,470
Vivo Z1x (Fusion Blue| 128 GB),Rs.18990,4.53,969
Vivo Y91 (Nebula Purple| 32 GB),Rs.8490,4.413,957
Vivo U10 (Electric Blue| 64 GB),Rs.11990,4.42,572
Vivo Z1x (Phantom Purple| 128 GB),Rs.18990,4.53,969
Vivo Z1x (Fusion Blue| 64 GB),Rs.16990,4.41,17,470
Vivo Z1x (Phantom Purple| 128 GB),Rs.17990,4.41,17,470
Vivo Z1x (Phantom Purple| 64 GB),Rs.16990,4.41,17,470
Vivo Y15 (Burgundy Red| 64 GB),Rs.11990,4.415,173
Vivo Y15 (Aqua Blue| 64 GB),Rs.11990,4.415,173
Vivo S1 Pro (Mystic Black| 128 GB),Rs.18990,4.54,760
Vivo Y12 (Aqua Blue| 64 GB),Rs.9990,4.47,278
Vivo Y12 (Burgundy Red| 64 GB),Rs.9990,4.47,278
Vivo Y91i (Ocean Blue| 32 GB),Rs.6990,4.312,848
Vivo Y91i (Fusion Black| 32 GB),Rs.6990,4.312,848
Vivo S1 (Diamond Black| 128 GB),Rs.15990,4.57,588
Vivo U20 (Racing Black| 64 GB),Rs.11990,4.41,002
Vivo NEX (Black| 128 GB),Rs.39990Upto ,4.1548
Vivo V15 Pro (Ruby Red| 128 GB),Rs.19990,4.528,403
Vivo Y17 (Mineral Blue| 128 GB),Rs.13990,4.411,047
Vivo U10 (Thunder Black| 64 GB),Rs.10490,4.412,464
Vivo S1 (Skyline Blue| 64 GB),Rs.17990,4.51,966
Vivo V9 Youth (Black| 32 GB),Rs.8990,4.426,640
Vivo V11 Pro (Starry Night Black| 64 GB),Rs.14990,4.528,373
Vivo V11 (Starry Night Black| 64 GB),Rs.24990Upto ,4.517,583
Vivo V7 (Gold| 32 GB),Rs.18990Upto ,4.411,544
Vivo Y71 (Gold| 16 GB),Rs.11990Upto ,4.33,780
Vivo Y81i (Black| 16 GB),Rs.6990,4.43,876
Vivo V17Pro (Midnight Ocean Black| 128 GB),Rs.27990,4.56,467
Vivo Y81i (Gold| 16 GB),Rs.6990,4.43,876
Vivo Y71i (Matte Black| 16 GB),Rs.9990Upto ,4.35,405
Vivo V11 (Nebula Purple| 64 GB),Rs.24990Upto ,4.517,583
Vivo V5 Plus (Gold| 64 GB),Rs.25990,4.34,472
Vivo V5s Perfect Selfie (Matte Black| 64 GB),Rs.18990Upto ,4.315,538
Vivo Y71 (Matte Black| 16 GB),Rs.11990Upto ,4.33,780
Vivo Y12 (BURGUNDY RED| 64 GB),Rs.9990,4.47,278
Vivo Y91i (Fusion Black| 16 GB),Rs.7499,4.312,848
Vivo Y83 (Gold| 32 GB),Rs.11790,4.410,916
Vivo Y93 (Nebula Purple| 64 GB),Rs.11999,4.49,123
Vivo Y53i (Matte Black| 16 GB),Rs.7990,4.21,196
Vivo Y93 (Nebula Purple| 32 GB),Rs.15680,4.43,288
Vivo V7 (Energetic Blue| 32 GB),Rs.15990,4.411,544
Vivo Y69 (Matte Black| 32 GB),Rs.13900,4.35,480
Vivo Y66 (Crown Gold| 32 GB),Rs.14990Upto ,4.34,507
Vivo Y71i (Gold| 16 GB),Rs.9990Upto ,4.35,405
Vivo V9 (Sapphire Blue| 64 GB),Rs.23990Upto ,4.589,342
Vivo V5s Perfect Selfie (Crown Gold| 64 GB),Rs.18990Upto ,4.315,538
Vivo Z1x (Phantom Purple| 128 GB),Rs.15799,4.510,608
Vivo Z1x (Fusion Blue| 128 GB),Rs.15799,4.510,608
Vivo V17 (Admiral Blue| 128 GB),Rs.22499,4.55,503
Vivo Z1Pro (Mirror Black| 64 GB),Rs.14799,4.53,12,821
Vivo Y51L (Black| 16 GB),Rs.8999,4.13,884
Vivo V9 Pro (Nebula Purple| 64 GB),Rs.17990Upto ,4.536,352
Vivo Y53i (Crown Gold| 16 GB),Rs.8990Upto ,4.21,196
Vivo V7+ (Energetic Blue| 64 GB),Rs.22221Upto ,4.417,313
Vivo X5 (White| 16 GB),Rs.19899,2.833
Vivo Y51L (White| 16 GB),Rs.8990,4.13,884
Vivo V5Plus Limited Edition (Matte Black| 64 GB),Rs.25990Upto ,4.41,581
Vivo Y55S (Grey| 16 GB),Rs.13490Upto ,4.23,788
Vivo V9 Pro (Black| 64 GB),Rs.17990Upto ,4.536,352
Vivo Z10 (Gold| 32 GB),Rs.13149,4.249
Vivo Y55L (Gold| 16 GB),Rs.5999,4.21,451
Vivo Y55L (Grey| 16 GB),Rs.8499,4.21,451
Vivo V7 (Matte Black| 32 GB),Rs.18990Upto ,4.411,544
Vivo X21 (Black| 128 GB),Rs.36990Upto ,4.21,890
Vivo V15 Pro (Ruby Red| 128 GB),Rs.32000,4.52,823
Vivo V5 (Crown gold| 32 GB),Rs.17980,4.37,646
Vivo Y12 (Aqua Blue| 32 GB),Rs.13999,4.31,292
Vivo V17Pro (Glacier Ice White| 128 GB),Rs.25900,4.56,467
Vivo Y91 (Starry Black| 32 GB),Rs.8990,4.35,902
Vivo Y95 (Starry Black| 64 GB),Rs.14990,4.416,174
Vivo V7+ (Gold| 64 GB),Rs.20600,4.417,313
Vivo Y93 (Starry Black| 64 GB),Rs.14782,4.49,123
Vivo U20 (Racing Black| 64 GB),Rs.12970,4252
Vivo Y12 (Burgundy Red| 32 GB),Rs.12790,4.31,292
Vivo V9 (Gold| 64 GB),Rs.23970,4.589,342
Vivo V9 (Pearl Black (Golden Line)| 64 GB),Rs.18900,4.589,342
Vivo V9 Pro (Black| 64 GB),Rs.16300,4.376
Vivo Y83 Pro (Nebula Purple| 64 GB),Rs.14500,4.45,933
Vivo Y83 Pro (Gold| 64 GB),Rs.14500,4.45,933
Vivo Y81 (Black| 32 GB),Rs.14538,4.32,544
Vivo Y71 (Gold| 32 GB),Rs.10299,4.32,632
Vivo V11 Pro (Dazzling Gold| 64 GB),Rs.22654,4.528,373
Vivo Y69 (Gold| 32 GB),Rs.13990,4.35,480
Vivo Y53 (Matte Black| 16 GB),Rs.8490,4.25,879
Vivo V15 (Glamour Red| 64 GB),Rs.24990,4.434,290
Vivo V3 Max (Gold| 32 GB),Rs.19999,4.1553
